{
  "engine_version": "bazi-engine-real-calc-py310-v2",
  "school": "bazi_ziping_v1",
  "calc_basis": {
    "calendar_type": "solar",
    "timezone": "Asia/Shanghai",
    "true_solar_time": false,
    "real_calendar": true,
    "month_rule": "jieqi",
    "day_rule": "sect_2",
    "library_name": "lunar_python"
  },
  "input_snapshot": {
    "birth_date": "1995-11-16",
    "birth_time": "12:30",
    "birth_place": "江苏省徐州市睢宁县",
    "gender": "male",
    "calendar_type": "solar",
    "timezone": "Asia/Shanghai",
    "true_solar_time": false,
    "school": "bazi_ziping_v1"
  },
  "solar_datetime": "1995-11-16T12:30:00+08:00",
  "pillars": {
    "year": {
      "stem": "乙",
      "branch": "亥",
      "ganzhi": "乙亥"
    },
    "month": {
      "stem": "丁",
      "branch": "亥",
      "ganzhi": "丁亥"
    },
    "day": {
      "stem": "辛",
      "branch": "亥",
      "ganzhi": "辛亥"
    },
    "hour": {
      "stem": "甲",
      "branch": "午",
      "ganzhi": "甲午"
    }
  },
  "day_master": "辛",
  "luck_cycle": {
    "basis": {
      "direction_rule": "year_stem_polarity_with_gender: yang_male_or_yin_female_forward_else_backward",
      "start_age_rule": "sect_1_conversion: 3_days_1_year, 1_day_4_months, 1_shichen_10_days",
      "jieqi_anchor_rule": "forward_next_jie_backward_previous_jie",
      "library_name": "lunar_python",
      "enabled": true
    },
    "direction": "backward",
    "start_age": 2.8,
    "start_datetime": "1998-08-16T12:30:00+08:00",
    "cycles": [
      {
        "index": 1,
        "ganzhi": "丙戌",
        "stem": "丙",
        "branch": "戌",
        "start_age": 2.8,
        "end_age": 12.8,
        "start_year": 1998,
        "end_year": 2008,
        "evidence_refs": [
          "E207",
          "E209"
        ]
      },
      {
        "index": 2,
        "ganzhi": "乙酉",
        "stem": "乙",
        "branch": "酉",
        "start_age": 12.8,
        "end_age": 22.8,
        "start_year": 2008,
        "end_year": 2018,
        "evidence_refs": [
          "E207",
          "E209"
        ]
      },
      {
        "index": 3,
        "ganzhi": "甲申",
        "stem": "甲",
        "branch": "申",
        "start_age": 22.8,
        "end_age": 32.8,
        "start_year": 2018,
        "end_year": 2028,
        "evidence_refs": [
          "E207",
          "E209"
        ]
      },
      {
        "index": 4,
        "ganzhi": "癸未",
        "stem": "癸",
        "branch": "未",
        "start_age": 32.8,
        "end_age": 42.8,
        "start_year": 2028,
        "end_year": 2038,
        "evidence_refs": [
          "E207",
          "E209"
        ]
      },
      {
        "index": 5,
        "ganzhi": "壬午",
        "stem": "壬",
        "branch": "午",
        "start_age": 42.8,
        "end_age": 52.8,
        "start_year": 2038,
        "end_year": 2048,
        "evidence_refs": [
          "E207",
          "E209"
        ]
      },
      {
        "index": 6,
        "ganzhi": "辛巳",
        "stem": "辛",
        "branch": "巳",
        "start_age": 52.8,
        "end_age": 62.8,
        "start_year": 2048,
        "end_year": 2058,
        "evidence_refs": [
          "E207",
          "E209"
        ]
      },
      {
        "index": 7,
        "ganzhi": "庚辰",
        "stem": "庚",
        "branch": "辰",
        "start_age": 62.8,
        "end_age": 72.8,
        "start_year": 2058,
        "end_year": 2068,
        "evidence_refs": [
          "E207",
          "E209"
        ]
      },
      {
        "index": 8,
        "ganzhi": "己卯",
        "stem": "己",
        "branch": "卯",
        "start_age": 72.8,
        "end_age": 82.8,
        "start_year": 2068,
        "end_year": 2078,
        "evidence_refs": [
          "E207",
          "E209"
        ]
      },
      {
        "index": 9,
        "ganzhi": "戊寅",
        "stem": "戊",
        "branch": "寅",
        "start_age": 82.8,
        "end_age": 92.8,
        "start_year": 2078,
        "end_year": 2088,
        "evidence_refs": [
          "E207",
          "E209"
        ]
      },
      {
        "index": 10,
        "ganzhi": "丁丑",
        "stem": "丁",
        "branch": "丑",
        "start_age": 92.8,
        "end_age": 102.8,
        "start_year": 2088,
        "end_year": 2098,
        "evidence_refs": [
          "E207",
          "E209"
        ]
      }
    ],
    "evidence_refs": [
      "E207",
      "E208",
      "E209"
    ]
  },
  "status": "ok"
}
